{"$schema":"http://json-schema.org/draft-07/schema#","title":"Design Skills","type":"array","minItems":1,"items":{"type":"object","required":["id","name","description","relevantDecisions"],"properties":{"id":{"type":"string","pattern":"^[a-z][a-z0-9-]*$"},"name":{"type":"string","minLength":2},"description":{"type":"string","minLength":10},"relevantDecisions":{"type":"array","minItems":1,"items":{"type":"string"}}},"additionalProperties":false}}